{
  "schema": "openrig.journey/v1",
  "id": "harness-check",
  "version": 1,
  "kind": "harness_check",
  "title": "A harness OpenRig can drive on this machine",
  "requiredSteps": [
    { "id": "on-path", "description": "The harness is installed and on PATH." },
    { "id": "version-supported", "description": "Its version is one OpenRig drives." },
    { "id": "signed-in", "description": "It is signed in and answers a request." }
  ]
}
